<?xml version="1.0" encoding="UTF-8"?>
<greenhouse xmlns:xsi="http://www.w3.org/2001/XMLSchema-instance"
 xsi:noNamespaceSchemaLocation="Schema.xsd">
 <flower id="ID-1">
    <name>Tulip</name>
    <soil>podzol</soil>
    <origin>Netherlands</origin>
    <visuals>
       <stalk_length>30</stalk_length>
       <color>red</color>
       <flower_diameter>10</flower_diameter>
    </visuals>
    <tips>
       <temperature>18</temperature>
       <illumination>7</illumination>
       <irrigation>10</irrigation>
    </tips>
    <reproduction>leaves</reproduction>
 </flower>
 <flower id="ID-2">
    <name>Rose</name>
    <soil>turf_podzol</soil>
    <origin>England</origin>
    <visuals>
       <stalk_length>150</stalk_length>
       <color>deep-red</color>
       <flower_diameter>15</flower_diameter>
    </visuals>
    <tips>
       <temperature>20</temperature>
       <illumination>7</illumination>
       <irrigation>100</irrigation>
    </tips>
    <reproduction>stalks</reproduction>
 </flower>

</greenhouse>